<?xml version="1.0" encoding="UTF-8"?>
<annuaire xmlns:xsi="http://www.w3.org/2001/XMLSchema-instance"
    xsi:noNamespaceSchemaLocation="annuaire.xsd">
    <personne matricule="AB123">
        <nom>Alami</nom>
        <prenom>Wafae</prenom>
        <telephone>0661112233</telephone>
        <email>alami@ensias.ma</email>
        <sexe>F</sexe>
        <DateNaissance>1980-10-10</DateNaissance>
        <adresse> 
            <rue numero="12">Sebta </rue>
            <ville>Rabat</ville> 
        </adresse> 
    </personne>
    <personne matricule ="XZ123" nationalite="FRA">
        <nom>Alaoui</nom>
        <prenom>Adam</prenom>
        <telephone>0674152638</telephone>
        <email>adam_alaoui@ensias.ma</email>
        <sexe>M</sexe>
        <DateNaissance>1970-11-10</DateNaissance>
        <adresse> 
            <rue numero="12">Sebta</rue>
            <ville>Casablanca</ville> 
        </adresse>
    </personne>
</annuaire>